2016-01-13T17:49:54Z,"b'Hillary Clinton and Bernie Sanders Intensify Fight over Health, Guns and Costs'",b'By MAGGIE HABERMAN and ALAN RAPPEPORT',,948,"['Clinton, Bill', 'Clinton, Chelsea']"
2016-01-13T17:08:50Z,b'Sanders Congressional Record Under Scrutiny by Clinton',b'By THE ASSOCIATED PRESS',"b'Bernie Sanders casts himself as the voice of anti-establishment politics, fueling his insurgent rise in the Democratic primaries as a principled fighter unwilling to compromise for political gain.'",932,NA
2016-01-13T14:09:02Z,"b""AP Conversation: Bush Sees Conservatism at Stake in '16""",b'By THE ASSOCIATED PRESS',"b'Jeb Bush says he misjudged the intensity of anger among Republican voters before his White House campaign and believes the country in 2016 is ""dramatically different"" than in past elections. Yet he insists he\'s still a viable candidate, and one who has broadened his mission to include defending conservativism from GOP front-runner Donald Trump.'",1153,NA
2016-01-13T13:34:35Z,"b""Obama's State of the Union Gets Most Young Love in the West""",b'By REUTERS',"b""Millennnials in the West of the United States showed the strongest support for President Barack Obama's final State of the Union address, according to data provided by Yik Yak, a location-based mobile app that is popular with young people.""",460,NA
2016-01-13T12:12:56Z,"b""Christie Warns Voters: Don't Elect a First-Term Senator""",b'By THE ASSOCIATED PRESS',"b'Chris Christie is pressing people in New Hampshire to avoid voting for a first-time senator in the coming presidential primary, and holding out Barack Obama as an example of what can happen when they do.'",398,NA
2016-01-13T12:01:42Z,b'What Would You Ask Hillary Clinton?',b'By THE EDITORS',,91,"['Clinton, Hillary Rodham', 'Democratic Party']"
2016-01-13T10:40:08Z,"b'Verbatim: What Hillary Clinton, Powerball Winner, Would Do'",b'By FIRST DRAFT',,36,"['Clinton, Hillary Rodham', 'Campaign Finance']"
2016-01-13T07:00:28Z,"b'As Bernie Sanders Gains Momentum, Hillary Clinton Shows Signs of Noticing'",b'By MAGGIE HABERMAN',,346,NA
2016-01-13T06:15:39Z,b'2 Democrats Seek to Take Gunmakers&#8217; Liability Shield',b'By JENNIFER STEINHAUER',,303,"['Schiff, Adam B', 'Democratic Party']"
2016-01-13T03:57:16Z,b'Clinton Gets Nod From Former Attorney General Eric Holder',b'By THE ASSOCIATED PRESS',"b""As she works to maintain an advantage among African-American voters in her quest for the Democratic presidential nomination, Hillary Clinton has secured an endorsement from the nation's first black attorney general.""",563,NA
2016-01-13T03:51:25Z,b'Sanders Ad Burst Coincides With Upward Movement in Polls',b'By THE ASSOCIATED PRESS',b'Bernie Sanders has been putting up major advertising cash to seize momentum heading into the Democratic presidential primaries &#8212; outspending his rival Hillary Clinton just as voters are beginning to pay attention to the race.',920,NA
2016-01-13T03:34:52Z,b'Obama Summons Americans to Compromise and Change',b'By THE ASSOCIATED PRESS',"b'With Americans soon to begin choosing his successor, President Barack Obama is casting his seven divisive years as a time of positive change, implicitly asking voters to replace him with a Democrat who would continue his hard-won policies on health care, climate change and Iran.'",914,NA
2016-01-13T03:28:39Z,b'Analysis: Obama in Campaign Form in Final State of the Union',b'By THE ASSOCIATED PRESS',"b""President Barack Obama opened his State of the Union speech saying he'd keep it short, in what must have seemed music to the ears of some in the chamber antsy to get to Iowa to campaign for president.""",812,NA
2016-01-13T01:33:18Z,b'Trump Looms Behind Both Obama and Haley Speeches',b'By REUTERS',"b'Donald Trump was not in the room during U.S. President Barack Obama&#8217;s final State of the Union speech, but the Republican presidential front-runner was a looming presence nonetheless. '",854,NA
2016-01-13T00:54:15Z,"b'Obama Knocks Trump, Voices Optimism'",b'By REUTERS',b'By Jeff Mason and Roberta Rampton',963,NA
2016-01-13T00:00:00Z,b'How Nikki Haley Was Redeemed by Donald Trump',b'By ANAND GIRIDHARADAS',"b'The governor\xe2\x80\x99s identity may feel tailored to reassure white Americans \xe2\x80\x94 but in her response to the State of the Union address, she appealed to a nation united by something deeper than appearances.'",1155,"['Haley, Nikki R', 'Jindal, Bobby']"
2016-01-13T00:00:00Z,b'Imagining Trump Going the Distance',b'By JOHN HARWOOD',"b'Impressed by Donald J. Trump\xe2\x80\x99s resilience so far, a veteran political strategist now believes Mr. Trump could capture the Republican nomination.'",658,"['Trump, Donald J', 'Rubio, Marco']"
2016-01-13T00:00:00Z,"b'Your Wednesday Briefing: Obama, Iran, N.F.L.'",b'By ADEEL HASSAN',b'Here\xe2\x80\x99s what you need to know to start your day.',994,NA
2016-01-13T00:00:00Z,b'What to Watch Wednesday',b'By KATHRYN SHATTUCK',b'\xe2\x80\x9cSecond Chance\xe2\x80\x9d deserves a second look. Sutton Foster shaves off the years in \xe2\x80\x9cYounger.\xe2\x80\x9d And Jerry Seinfeld takes Kathleen Madigan for a spin.',520,Television
2016-01-13T00:00:00Z,b'State of the Union Speech Is One Half of Nation\xe2\x80\x99s Political Split Screen',b'By PETER BAKER',"b'As he begins his final stretch, President Obama has been trying to counter the glass-is-half-empty view coming from so many candidates intent on succeeding him.'",1168,"['State of the Union Message (US)', 'Obama, Barack']"
2016-01-13T00:00:00Z,b'Hillary Clinton\xe2\x80\x99s Lead Over Bernie Sanders Slipping in New Poll',b'By THOMAS KAPLAN and DALIA SUSSMAN',"b'A New York Times/CBS News poll finds a sharp generational divide within the Democratic Party, with voters under 45 favoring Mr. Sanders.'",1197,"['Presidential Election of 2016', 'Polls and Public Opinion']"
2016-01-13T00:00:00Z,"b'Saudi Arabia Arrests Samar Badawi, Human Rights Advocate'",b'By BEN HUBBARD',"b'The arrest of Ms. Badawi, who has pushed for more rights for women, is the kingdom\xe2\x80\x99s latest effort to clamp down on dissent, advocacy groups said.'",385,"['Saudi Arabia', 'Badawi, Samar (1981- )']"
2016-01-13T00:00:00Z,b'Hillary Clinton Races to Close Enthusiasm Gap With Bernie Sanders in Iowa',b'By PATRICK HEALY and YAMICHE ALCINDOR',"b'With voters mobbing Mr. Sanders at events in the state, exposing a disparity in passion for the two Democrats, Mrs. Clinton has gone on the attack and tried to energize supporters.'",1423,"['Presidential Election of 2016', 'Clinton, Hillary Rodham']"
2016-01-12T21:45:20Z,b'Hillary Clinton Releases Ad Supporting Obama&#8217;s Gun Control Efforts',b'By AMY CHOZICK',,240,"['Clinton, Hillary Rodham', 'Sanders, Bernard']"
2016-01-12T20:26:29Z,"b""Chelsea Clinton Stands Her Mother's Ground in New Hampshire""",b'By REUTERS',"b'U.S. Democratic presidential candidate Hillary Clinton cannot be in two places at once in the weeks before the first party-nominating contests in Iowa and New Hampshire, but she came close on Tuesday with daughter Chelsea Clinton&#8217;s campaign trail debut. '",443,NA
2016-01-12T19:37:15Z,b'Clinton Expands on Plan to Tax Wealthy as Sanders Gains in Polls',b'By REUTERS',b'U.S. Democratic presidential candidate Hillary Clinton on Tuesday expanded her plan to tax the wealthiest Americans by saying she would close tax-avoidance &#8220;loopholes&#8221; that allow investments to be routed through low-tax countries and put in tax-deferred retirement accounts.',352,NA
2016-01-12T19:31:41Z,"b'Hillary Clinton, a Surging Rival and the Return of the &#8216;Magic Wand&#8217;'",b'By MAGGIE HABERMAN',,273,"['Clinton, Hillary Rodham', 'Obama, Barack']"
2016-01-12T19:30:03Z,b'Ted Cruz Suggests Donald Trump Is Taking Cues From Democrats',b'By MATT FLEGENHEIMER and NICK CORASANITI',,887,"['Cruz, Ted', 'Trump, Donald J']"
2016-01-12T18:46:42Z,"b'Chelsea Clinton, Again Her Mother&#8217;s Surrogate, Takes Up the Fight Against Bernie Sanders'",b'By NICK CORASANITI',,539,"['Clinton, Chelsea', 'Clinton, Hillary Rodham']"
2016-01-12T17:06:21Z,b'Cruz Promises to Defend Gun Rights in NH Campaign Swing',b'By THE ASSOCIATED PRESS',"b'Ted Cruz on Tuesday returned to New Hampshire for the first time in months, promising conservative voters he\'ll protect their gun rights and several times invoking the state\'s ""Live Free or Die"" motto.'",285,NA
2016-01-12T16:48:12Z,"b""The Latest: Obama Takes 'One More Look at This Thing'""",b'By THE ASSOCIATED PRESS',"b""The latest on President Barack Obama's last State of the Union address. All times EST:""",3861,NA
2016-01-12T16:22:23Z,"b'Republican Cruz Rips Trump, Links Him to Clinton'",b'By REUTERS',"b'Republican presidential candidate Ted Cruz sought on Tuesday to link his rival Donald Trump to Democrat Hillary Clinton, saying it would make her supporters happy if the real estate mogul were to win the Republican nomination.'",304,NA
2016-01-12T14:37:47Z,b'Hillary Clinton Accuses Bernie Sanders of Not Standing Up to Gun Lobby',b'By PATRICK HEALY',,941,"['Clinton, Hillary Rodham', 'Sanders, Bernard']"
2016-01-12T14:27:01Z,"b""State Dept. To Review 29,000 Pages of Clinton Aide's Emails""",b'By THE ASSOCIATED PRESS',"b'The State Department has agreed to review 29,000 pages of emails from Huma Abedin, a close aide to Democratic presidential candidate Hillary Clinton, from their days at the State Department for possible public release under a new legal agreement with a conservative legal group. But even as Clinton presses her campaign, many of the emails would not be publicly released until six months after the election.'",524,NA
2016-01-12T14:08:20Z,b'Chelsea Clinton Campaigns for Hillary',b'By REUTERS',"b'Chelsea Clinton told an audience in Concord, N.H., that becoming a grandmother has made Hillary Clinton more determined.'",18,"['Clinton, Chelsea', 'Clinton, Hillary Rodham']"
2016-01-12T13:40:26Z,b'Hillary Clinton Gets Backing of Food Services Union',b'By AMY CHOZICK',,311,"['Clinton, Hillary Rodham', 'Sanders, Bernard']"
2016-01-12T12:20:58Z,"b'With Democratic Race Narrowing, Clinton Rips Into Sanders'",b'By THE ASSOCIATED PRESS',"b'Facing a narrowing primary contest, Hillary Clinton ripped into rival Bernie Sanders on Tuesday, saying the Vermont senator was offering unrealistic policies and overstating his anti-establishment credentials.'",1003,NA
2016-01-12T12:00:29Z,"b""Chelsea Clinton Visits New Hampshire Backing Mom's Campaign""",b'By THE ASSOCIATED PRESS',"b""Making her debut appearance in the 2016 presidential race, Chelsea Clinton pivoted between personal anecdotes and detailed policy points while campaigning for her mother Hillary Clinton in New Hampshire Tuesday ahead of the state's leadoff presidential primary.""",311,NA
2016-01-12T11:00:36Z,"b'Bernie Sanders Has Edge in Iowa and Widens New Hampshire Lead, Polls Find'",b'By ALAN RAPPEPORT',,648,"['Clinton, Hillary Rodham', ""O'Malley, Martin J""]"
2016-01-12T10:36:52Z,b'MoveOn Site Puts Its Backing Behind Bernie Sanders',b'By MAGGIE HABERMAN',,262,"['Clinton, Hillary Rodham', ""O'Malley, Martin J""]"
2016-01-12T08:52:09Z,b'Sanders Campaign Endorsed by MoveOn.org',b'By THE ASSOCIATED PRESS',"b'Democratic presidential candidate Bernie Sanders has won the endorsement of MoveOn.org, a grassroots organization that has been at the forefront of liberal causes.'",132,NA
2016-01-12T07:43:54Z,"b""Biden: Sanders Has 'Struck a Chord With Voters' in Race With Clinton""",b'By REUTERS',"b'U.S. Vice President Joe Biden praised Democratic presidential candidate Bernie Sanders for tapping into Americans&#8217; concerns about growing income inequality, potentially giving the Vermont senator a boost as he gains on rival Hillary Clinton weeks before the Iowa caucuses.'",567,NA
2016-01-12T07:00:22Z,"b'Poll Watch: Obama&#8217;s Gun Policies Are Popular, but Verdict Is Mixed on Other Issues'",b'By PETER BAKER and MEGAN THEE-BRENAN',,767,"['Obama, Barack', 'Gun Control']"
2016-01-12T06:30:16Z,b'Chelsea Clinton to Campaign in New Hampshire Amid Threat From Sanders',b'By NICK CORASANITI',,216,"['Clinton, Bill', 'Clinton, Chelsea']"
2016-01-12T03:41:22Z,"b'State of Union in 2016: Strong Job Market, Middling Economy'",b'By THE ASSOCIATED PRESS',b'President Barack Obama delivers his final State of the Union address on Tuesday night to a nation whose economy is far sturdier than it was when he took office in 2009.',862,NA
2016-01-12T03:26:14Z,b'Immigrant Raids Divide Obama From Democrats and Clinton',b'By THE ASSOCIATED PRESS',"b'Federal immigration raids have wrenched open new divides between President Barack Obama and his Democratic allies, including the woman who hopes to replace him, Hillary Clinton.'",852,NA
2016-01-12T03:20:00Z,"b""Reflecting on Obama's Presidency """,b'By THE ASSOCIATED PRESS',,2941,News
2016-01-12T01:11:53Z,"b'Obama Knocks Republicans for Anti-Muslim Rhetoric, Seeks to Set 2016 Tone'",b'By REUTERS',b'President Barack Obama knocked Republican presidential candidates for anti-Muslim rhetoric and accused critics on Tuesday of playing into the hands of Islamic State in a speech aimed at setting an optimistic tone for his last year in office.',724,NA
2016-01-12T00:21:53Z,b'Hillary Clinton Promises Not to Be &#8216;Deporter in Chief&#8217;',b'By ALAN RAPPEPORT',,572,"['Clinton, Hillary Rodham', 'Iowa']"
2016-01-12T00:00:00Z,"b'Your Tuesday Evening Briefing: David Bowie, Istanbul, Bernie Sanders'",b'By FINN COHEN and SANDRA STEVENSON',b'Here\xe2\x80\x99s what you need to know at the end of the day.',735,NA
2016-01-12T00:00:00Z,"b'Your Tuesday Briefing: Istanbul, Rupert Murdoch, David Bowie'",b'By ADEEL HASSAN',b'Here\xe2\x80\x99s what you need to know to start your day.',1079,NA
2016-01-12T00:00:00Z,b'Willie Horton\xe2\x80\x99s Heirs',b'By EMMA ROLLER',b'New ads from Donald Trump and Ted Cruz are part of a tradition that began with a race-baiting 1988 spot.',1408,"['Presidential Election of 2016', 'Political Advertising']"
2016-01-11T23:34:48Z,b'Clinton Calls for an End to U.S. Immigration Raids',b'By REUTERS',"b'Democratic presidential candidate Hillary Clinton called on Monday for an end to raids by U.S. officials to deport undocumented Central American families, saying they were divisive and sowing fear in immigrant communities.'",384,NA
2016-01-11T22:25:03Z,"b'Veep Biden Defends Bernie Sanders on Guns, Authenticity'",b'By THE ASSOCIATED PRESS',"b""Vice President Joe Biden described Democratic presidential hopeful Bernie Sanders on Monday as more authentic on economic inequality than Hillary Clinton, and he defended Sanders' record on gun control.""",578,NA
2016-01-11T22:08:29Z,b'Clinton Calls on White House to Stop Deportation Raids',b'By THE ASSOCIATED PRESS',b'Hillary Clinton is calling on the Obama administration to end raids aimed at deporting Central Americans who entered the United States illegally.',126,NA
2016-01-11T18:57:05Z,"b""White Supremacists, in Campaign Calls for Trump, Say: 'We Don't Need Muslims'""",b'By REUTERS',"b'A white supremacist group said it has placed thousands of automated phone calls in Iowa urging voters to back billionaire Donald Trump\'s bid for the Republican presidential nomination because ""we don\'t need Muslims.""'",759,NA
2016-01-11T18:38:27Z,b'Exclusive: State Attorneys General Joining Probe of Health Insurer Mergers',b'By REUTERS',"b""About 15 state attorneys general have joined the Justice Department's probe of two big insurance mergers, according to people familiar with the matter, increasing the scrutiny on proposed deals that would reduce the number of nationwide health insurers to three from five.""",656,NA
2016-01-11T17:55:58Z,b'Julian Castro Warns Latinos Would Suffer if G.O.P. Abandons Health Law',b'By JOHN CORRALES',,311,NA
2016-01-11T16:53:02Z,b'Judge Dismisses Pair of Lawsuits Arising From Clinton Emails',b'By THE ASSOCIATED PRESS',"b""A federal judge has dismissed a pair of lawsuits arising from Democratic presidential candidate Hillary Clinton's use of a personal email server as secretary of state.""",132,NA
2016-01-11T16:18:56Z,b'Secret Service Agent Recovering From Car Crash Gets Married',b'By THE ASSOCIATED PRESS',"b""A Secret Service agent severely injured in a car crash in New Hampshire last month has married his fiancee at a Boston hospital where he's being treated.""",133,NA
2016-01-11T16:03:44Z,b'Hillary Clinton Confronts Bernie Sanders as Polls Show Her Lead in Iowa Narrowing',b'By ALAN RAPPEPORT',,968,"['Clinton, Hillary Rodham', 'Sanders, Bernard']"
2016-01-11T14:51:52Z,"b""Obama's State of the Union Address Seeks to Frame 2016 Race""",b'By THE ASSOCIATED PRESS',"b""President Barack Obama's final State of the Union address will unmistakably attempt to frame the choice facing Americans as they select his successor, doling out an optimistic vision of the country's future in contrast with what he sees as the pessimism that's pervasive in the Republican primary.""",762,NA
2016-01-11T14:31:31Z,b'Clinton Confronts Rival Sanders as Iowa Polls Tighten',b'By THE ASSOCIATED PRESS',"b'Hillary Clinton has spent much of her 2016 presidential campaign looking past Democratic rival Bernie Sanders, focusing instead on Republicans and the November general election. No longer.'",957,NA
2016-01-11T14:21:05Z,b'Clinton Seeks Surcharge Tax on Wealthiest Tier of Americans',b'By REUTERS',b'U.S. Democratic presidential candidate Hillary Clinton on Monday proposed a 4 percent tax on the wealthiest sliver of taxpayers who earn more than $5 million per year.',357,NA
2016-01-11T14:02:39Z,b'House Votes to Strengthen Government Records Law',b'By THE ASSOCIATED PRESS',"b'The House approved legislation Monday making it easier to obtain government records, as a new congressional report concluded that the freedom of information process under the Obama administration is broken and in need of serious change.'",611,NA
2016-01-11T12:17:42Z,"b""Inside the New Hampshire Pitch to Those Who Don't Want Trump""",b'By THE ASSOCIATED PRESS',"b'For all the passionate support Donald Trump has amassed in New Hampshire, many Republicans and independent voters are just as passionate about not voting for Donald Trump.'",1430,NA
2016-01-11T12:11:14Z,b'FBI Expanding Investigation of Clinton Private Email Use: Fox',b'By REUTERS',"b""The FBI is widening its investigation of Democratic presidential candidate Hillary Clinton's use of a private email account while she was U.S. secretary of state to determine whether any public corruption laws were violated, Fox News reported on Monday.""",255,NA
2016-01-11T07:00:51Z,b'Two Debates Set the Course for a Contentious Final Sprint',b'By MAGGIE HABERMAN',,267,"['Charleston (SC)', 'Debates (Political)']"
2016-01-11T06:30:05Z,b'Marco Rubio Continues a General Election Approach to Primaries',b'By JEREMY W. PETERS',,283,"['Rubio, Marco', 'Florida']"
2016-01-11T03:35:09Z,"b'State of Union in 2016: Strong Job Market, Middling Economy'",b'By THE ASSOCIATED PRESS',b'President Barack Obama delivers his final State of the Union address on Tuesday night to a nation whose economy is far sturdier than it was when he took office in 2009.',862,NA
2016-01-11T00:00:00Z,"b'Your Monday Briefing: Hillary Clinton, Golden Globes, David Bowie'",b'By ADEEL HASSAN',b'Here\xe2\x80\x99s what you need to know to start your day.',1123,NA
2016-01-11T00:00:00Z,b'How to Be Liberal in Lower Alabama',b'By ROY HOFFMAN',b'Can liberals and conservatives get along in one of the country\xe2\x80\x99s reddest states?',960,"['United States Politics and Government', 'Alabama']"
2016-01-11T00:00:00Z,b'House to Weigh Overhaul of Open Records Process',b'By GARDINER HARRIS',b'The House is expected to consider a comprehensive overhaul of open records that would require the government to create a single online portal for requests to any government agency.',1122,"['Freedom of Information Act', 'United States Politics and Government']"
2016-01-11T00:00:00Z,b'Supreme Court Case on Public Sector Union Fees Rouses Political Suspicions',b'By NOAM SCHEIBER',b'Lawyers who organized the case are part of a center that is financially backed by conservative foundations. A decision in the plaintiff&#8217;s favor could free public sector workers from paying fees if they decline to join unions.',1317,"['Supreme Court (US)', 'Organized Labor']"
2016-01-11T00:00:00Z,b'Law on Ultrasounds Reignites Abortion Battle in North Carolina',b'By RICHARD FAUSSET',b'A new reporting requirement for doctors is providing fodder for races for governor and president this year in a polarized Southern swing state.',1104,"['Abortion', 'North Carolina']"
2016-01-11T00:00:00Z,"b'In Final State of the Union Address, Obama Aims to Set Tone for \xe2\x80\x9916 Campaign'",b'By PETER BAKER',b'Mr. Obama hopes to use his last address as president to frame the debate about who should replace him and where the country should go from here.',1265,"['Obama, Barack', 'State of the Union Message (US)']"
2016-01-10T16:46:09Z,b'Hillary Clinton Attacks Bernie Sanders Over Gun Control',b'By MAGGIE HABERMAN',,778,NA
2016-01-10T16:09:22Z,b'Planned Parenthood Backing Clinton in Primary Race',b'By THE ASSOCIATED PRESS',"b""Planned Parenthood is swinging behind Hillary Clinton in the Democratic presidential race and says that won't mean negative campaigning against her primary opponents.""",547,NA
2016-01-10T12:36:22Z,b'Clinton Says She Did Not Get Classified Information Through Email',b'By REUTERS',"b'Democratic presidential candidate Hillary Clinton said on Sunday that she did not ask for classified information to be sent over a non-secure system while heading the State Department, responding to the latest development in an issue that has dogged her campaign for months.'",316,NA
2016-01-10T11:30:32Z,"b""Hillary Clinton Brushes Off Trump's Swipes at Bill""",b'By THE ASSOCIATED PRESS',"b""Hillary Clinton is brushing off Donald Trump's persistent swipes at her husband, the former president.""",131,NA
2016-01-10T10:48:49Z,"b'As Foreign Crises Pile Up, Obama Seen Taking Few Risks in Final Year'",b'By REUTERS',"b'As Barack Obama prepares to deliver his final State of the Union address on Tuesday night, the U.S. president and his aides have insisted he will not be content simply to run out the clock on foreign policy and is acting decisively to tackle crises piling up around the globe.'",959,NA
2016-01-10T10:21:13Z,b'Bernie Sanders Makes Strong Showing in New Polls',b'By MAGGIE HABERMAN',,440,NA
2016-01-10T08:45:11Z,"b'State of Union in 2016: Strong Job Market, Middling Economy'",b'By THE ASSOCIATED PRESS',b'President Barack Obama delivers his final State of the Union address on Tuesday night to a nation whose economy is far sturdier than it was when he took office in 2009.',862,NA
2016-01-10T00:00:00Z,"b'Your Weekend Briefing: Ted Cruz, Hillary Clinton, Mexico'",b'By ANDREA KANNAPELL and SANDRA STEVENSON',b'Here\xe2\x80\x99s what you need to know about the week\xe2\x80\x99s top stories.',753,NA
2016-01-10T00:00:00Z,b'\xe2\x80\x98Girls\xe2\x80\x99 Creator Lena Dunham Visits Iowa on Tour to Support Hillary Clinton',b'By ALAN RAPPEPORT',"b'In Iowa City and Des Moines, Ms. Dunham made a feminist pitch to packed audiences of mostly young women about why they should vote for Mrs. Clinton.'",746,"['Presidential Election of 2016', 'Clinton, Hillary Rodham']"
2016-01-10T00:00:00Z,"b'Leo, Hillary and Their Bears'",b'By MAUREEN DOWD',"b'On long, grueling odysseys, politics can be a bear.'",945,"['Presidential Election of 2016', 'Clinton, Hillary Rodham']"
2016-01-10T00:00:00Z,b'Myanmar\xe2\x80\x99s Peace Prize Winner and Crimes Against Humanity',b'By NICHOLAS KRISTOF',b'Aung San Suu Kyi is taking power with silence on the government\xe2\x80\x99s abuse of the Rohingya minority.',1151,"['Aung San Suu Kyi', 'Myanmar']"
2016-01-10T00:00:00Z,"b'Hillary Clinton Ad Blasts Republicans, Saying Only She \xe2\x80\x98Can Stop Them\xe2\x80\x99'",b'By NICK CORASANITI',"b'The ad offers Mrs. Clinton as the sole alternative to the Republican candidates, portraying her as a battle-hardened candidate who can take them on.'",379,"['Presidential Election of 2016', 'Clinton, Hillary Rodham']"
2016-01-10T00:00:00Z,"b'For Republicans, Mounting Fears of Lasting Split'",b'By PATRICK HEALY and JONATHAN MARTIN',"b'In an election campaign with a different, angry feel, the party&#8217;s establishment is facing a people&#8217;s coup.'",1590,"['Presidential Election of 2016', 'United States Politics and Government']"
2016-01-10T00:00:00Z,b'How \xe2\x80\x98Crazy\xe2\x80\x99 Are the North Koreans?',b'By JOEL S. WIT',b'It\xe2\x80\x99s time to stop treating the government in Pyongyang like cartoon villains.',1022,"['North Korea', 'Nuclear Weapons']"
2016-01-10T00:00:00Z,"b'Christopher Hitchens\xe2\x80\x99s \xe2\x80\x98And Yet . . .\xe2\x80\x99 and Roger Scruton\xe2\x80\x99s \xe2\x80\x98Fools, Frauds and Firebrands\xe2\x80\x99'",b'By DAMON LINKER',"b'Hitchens and Scruton assess thinkers, writers and political figures.'",1247,"['Hitchens, Christopher', 'Scruton, Roger (1944- )']"
2016-01-10T00:00:00Z,b'Debbie Wasserman Schultz Thinks Young Women Are Complacent',b'Interview by ANA MARIE COX',"b'The chairwoman of the Democratic National Committee talks about sexist criticism, marijuana and Donald Trump.'",631,"['Schultz, Debbie Wasserman', 'Democratic National Committee']"
2016-01-10T00:00:00Z,"b'Morristown, N.J., Historic With a Lively Downtown'",b'By DAVE CALDWELL',"b'Residents come to the north-central New Jersey town for its convenient commute and pedestrian-friendly, walkable community.'",1297,"['Real Estate and Housing (Residential)', 'Morristown (NJ)']"
2016-01-09T22:02:56Z,b'Ted Cruz&#8217;s Iowa Bus Tour: T-Shirts and Votes Must Be Earned',b'By MATT FLEGENHEIMER',,265,"['Cruz, Heidi Nelson', 'Cruz, Ted']"
