2016-01-17T00:00:00Z,b'Jennifer Lawrence Is a Darling of Dior',b'By BEE SHAPIRO',"b'Working with onetime prot\xc3\xa9g\xc3\xa9es of the stylist Rachel Zoe, the actress will occasionally stray from the French house and wear Ralph Lauren or Schiaparelli.'",502,"['Fashion and Apparel', 'Lawrence, Jennifer']"
2016-01-17T00:00:00Z,b'Eileen Myles Wants Men to Take a Hike',b'By ANA MARIE COX',"b'The poet talks about running for president, voting as a sexual act and gender vacationing.'",691,"['Poetry and Poets', 'Women and Girls']"
2016-01-17T00:00:00Z,b'More \xe2\x80\x98Progressive\xe2\x80\x99 Than Thou',b'By BEVERLY GAGE',"b'This year\xe2\x80\x99s Democratic primary season has become a contest to claim this label \xe2\x80\x94 but in American politics, it has always had a slippery definition.'",1534,"['English Language', 'Liberalism (US Politics)']"
2016-01-16T22:40:39Z,"b'Bernie Sanders, Under Attack on 2005 Gun Vote, Says He Will Support Bill Rolling It Back'",b'By YAMICHE ALCINDOR',,410,"['Clinton, Hillary Rodham', 'Sanders, Bernard']"
2016-01-16T21:56:21Z,b'Sanders Says He Supports Repealing Gun Manufacture Immunity',b'By THE ASSOCIATED PRESS',"b'On the eve of the next Democratic debate, Vermont Sen. Bernie Sanders announced his support for legislation that would reverse a 2005 law granting gun manufacturers legal immunity that he once supported.'",777,NA
2016-01-16T17:58:29Z,"b'Hillary Clinton Praises Prisoner Release, Urges New Iran Sanctions'",b'By REUTERS',"b'Democratic presidential candidate Hillary Clinton on Saturday praised the release of Americans held by Iran, but urged new sanctions on Tehran over its ballistic missile testing program.'",119,NA
2016-01-16T15:36:58Z,b'Former FBI Agent Levinson Not Among Those to Be Freed by Iran',b'By REUTERS',"b'One prominent name was missing from the list of Americans to be released by Iran on Saturday: former U.S. law-enforcement agent Robert Levinson, who disappeared while visiting the country in 2007.'",584,NA
2016-01-16T13:48:45Z,"b'U.S. Republicans Laud Iran Prisoner Release, Attack Obama Strategy'",b'By REUTERS',"b'U.S. Republican presidential candidates on Saturday praised the release of five Americans held in Iran, but said the Obama administration had conceded too much to win their freedom.'",749,NA
2016-01-16T13:31:04Z,b'Ted Cruz Goes on Multipronged Attack Against Donald Trump',b'By MATT FLEGENHEIMER',,702,"['Cruz, Ted', 'Trump, Donald J']"
2016-01-16T09:54:45Z,"b""Slow Start for NY's Strict Medical Marijuana Program""",b'By THE ASSOCIATED PRESS',"b""When medical marijuana became available this month in New York, Brittany Barger was one of the first patients to navigate the state's rules and make it through a dispensary door.""",753,NA
2016-01-16T09:30:16Z,b'Iran Releases Americans in Breakthrough Prisoner Exchange',b'By THE ASSOCIATED PRESS',"b'Four Americans detained in Iran will be coming home and seven Iranians in U.S. custody also will win their freedom in a breakthrough swap negotiated by the longtime foes, officials in both countries said. As well, a fifth American was freed separately.'",987,NA
2016-01-16T09:05:50Z,"b'As Primary Race Tightens, Democrats Brace for a Messy Winter'",b'By THE ASSOCIATED PRESS',"b""There was a time when Democrats fretted about Hillary Clinton's presidential campaign becoming a coronation and leaving her without the tests of a primary season to prepare for a general election matchup against the Republican nominee.""",945,NA
2016-01-16T08:20:57Z,"b'For Better or Worse, Bill Clinton Not a Big Factor Among U.S. Voters: Poll'",b'By REUTERS',"b'Bill Clinton may not be the &#8220;secret weapon&#8221; that Hillary Clinton needs in the U.S. presidential race. And the former Democratic president may not become the albatross that Republican candidate Donald Trump expects, either.'",675,NA
2016-01-16T05:23:17Z,"b'Nuclear Sanctions Lifted as Iran, U.S. Agree on Prisoner Swap'",b'By REUTERS',b'Iran emerged from years of economic isolation on Saturday when world powers lifted crippling sanctions against the Islamic Republic in return for Tehran complying with a deal to curb its nuclear ambitions.',975,NA
2016-01-16T04:46:30Z,b'The Latest: Work Proceeds to Get Freed Americans Out of Iran',b'By THE ASSOCIATED PRESS',"b""The latest developments as Iran and world powers implement a landmark deal reached last year to curb Iran's nuclear activities in exchange for the lifting of international sanctions (all times local).""",2741,NA
2016-01-16T03:25:52Z,"b'Nuclear Sanctions Lifted as Iran, U.S. Agree on Prisoner Swap'",b'By REUTERS',b'Iran emerged from years of economic isolation on Saturday when world powers lifted crippling sanctions against the Islamic Republic in return for Tehran complying with a deal to curb its nuclear ambitions.',975,NA
2016-01-16T02:59:31Z,b'Guest Lineups for the Sunday News Shows',b'By THE ASSOCIATED PRESS',b'Guest lineups for the Sunday TV news shows:',87,NA
2016-01-16T02:58:31Z,"b""Bush Sees Similarities in His Foreign Policy and His Dad's""",b'By THE ASSOCIATED PRESS',"b""Jeb Bush believes he's got the best prescription for American foreign policy, from his strategies for deterring North Korea's nuclear ambitions, to destroying the Islamic State.""",1084,NA
2016-01-16T02:55:56Z,b'Hillary Clinton Campaign Deploys Husband Bill Very Carefully',b'By THE ASSOCIATED PRESS',"b'Bill Clinton promised voters in 1992 that they\'d be getting ""two for the price of one"" if they elected him to the White House &#8212; a presidential duo of the young Arkansas governor and his Yale Law-educated wife.'",847,NA
2016-01-16T00:00:00Z,"b'Hillary and Bernie, Punching'",b'By GAIL COLLINS',"b'The Democrats may have strayed off the high road, but they\xe2\x80\x99re a long way from Trump-Cruz territory.'",818,"['Presidential Election of 2016', 'Clinton, Hillary Rodham']"
2016-01-16T00:00:00Z,"b'New Yorkers, Self-Assured and Opinionated, Defend Their Values'",b'By N. R. KLEINFIELD',"b'They are brazen, terse, edgy and carry king-size ambition through a city of extremes. On Friday, the residents took exception to Senator Ted Cruz\xe2\x80\x99s recent remarks about \xe2\x80\x9cNew York values.\xe2\x80\x9d'",1280,"['Presidential Election of 2016', 'Cruz, Ted']"
2016-01-16T00:00:00Z,"b'Looking at Later Primaries, Bernie Sanders Works to Strengthen Black Support'",b'By YAMICHE ALCINDOR',b'The Vermont senator faces a daunting problem even if he wins Iowa and New Hampshire: winning over African-American voters in the more diverse states to follow.',1475,"['Presidential Election of 2016', 'Sanders, Bernard']"
2016-01-16T00:00:00Z,"b'Gingerly, Donald Trump Tries Out Some Campaign Conventions'",b'By MAGGIE HABERMAN and PATRICK HEALY',"b'As some polls have tightened and voting nears, Mr. Trump is starting to balance his unique, provocative style with running \xe2\x80\x9cthe Iowa way\xe2\x80\x9d and \xe2\x80\x9cthe New Hampshire way.\xe2\x80\x9d'",1277,"['Presidential Election of 2016', 'Trump, Donald J']"
2016-01-16T00:00:00Z,"b'Republicans in Congress Will\xc2\xa0Write 2016 Campaign Platform, Ryan Says'",b'By JENNIFER STEINHAUER and DAVID M. HERSZENHORN',"b'They said they would focus on national security, the economy, health care, poverty and the Constitution after a meeting in Baltimore.'",726,"['Ryan, Paul D Jr', 'Presidential Election of 2016']"
2016-01-16T00:00:00Z,b'The Rambunctious Republican Debate',b'By JENNIFER STEINHAUER and DAVID M. HERSZENHORN',b'Readers are largely dismayed by both the tone and content.',698,"['Presidential Election of 2016', 'Debates (Political)']"
2016-01-16T00:00:00Z,b'New Yorkers Quickly Unite Against Cruz After \xe2\x80\x98New York Values\xe2\x80\x99 Comment',b'By MARC SANTORA',"b'Gov. Andrew M. Cuomo and Mayor Bill de Blasio spoke out on Friday to criticize Senator Ted Cruz\xe2\x80\x99s swipe at Donald Trump and, by extension, New York, at the presidential debate on Thursday.'",697,"['Cruz, Ted', 'Presidential Election of 2016']"
2016-01-16T00:00:00Z,b'Who Won the Republican Debate? Ted Cruz and Donald Trump Impress Critics',b'By ALAN RAPPEPORT',"b'Commentators weighed in on Thursday\xe2\x80\x99s debate in South Carolina, where the challenge for many candidates was breaking through on a loud and crowded stage.'",505,"['Presidential Election of 2016', 'Debates (Political)']"
2016-01-15T23:08:05Z,"b'Ted Cruz &#8216;Apologizes&#8217; to New Yorkers, Again and Again'",b'By MATT FLEGENHEIMER',,363,"['Cruz, Ted', 'Trump, Donald J']"
2016-01-15T18:52:25Z,b'Campaign Aides Defend Bernie Sanders&#8217;s Record on Gun Votes',b'By MAGGIE HABERMAN',,620,"['Ashcroft, John', 'Bush, George W']"
2016-01-15T16:38:09Z,b'Director Bay: Benghazi Movie Steers Clear of Politics',b'By THE ASSOCIATED PRESS',"b'The very word ""Benghazi"" screams politics to most people &#8212; especially in this election year. So, is it even possible to make a movie about the deadly 2012 attacks in Benghazi, Libya, that\'s NOT political?'",675,NA
2016-01-15T16:20:04Z,b'Exclusive: Clinton Plans Ad Blitz as Primaries Kick Off-Campaign Document',b'By REUTERS',b'By Luciana Lopez',608,NA
2016-01-15T13:29:33Z,b'Carly Fiorina Is Not Even Good at Gratuitous Insults',b'By ANDREW ROSENTHAL',,367,"['Clinton, Hillary Rodham', 'Fiorina, Carleton S']"
2016-01-15T13:24:22Z,b'White House Hopeful Bush Lays Out Plans for Foreign Policy',b'By THE ASSOCIATED PRESS',"b""Jeb Bush believes he's got the best prescription for American foreign policy, from his strategies for deterring North Korea's nuclear ambitions, to destroying the Islamic State.""",1082,NA
2016-01-15T13:21:28Z,b'Capitol Hill Buzz: House Republicans Watch Benghazi Movie',b'By THE ASSOCIATED PRESS',"b""House Republicans are investigating the Benghazi attacks. And now they've seen the movie.""",179,NA
2016-01-15T12:20:26Z,"b'You Asked, Hillary Clinton Answered'",b'By THE EDITORS',,240,"['Clinton, Hillary Rodham', 'Senate']"
2016-01-15T12:04:55Z,b'Guest Lineups for the Sunday News Shows',b'By THE ASSOCIATED PRESS',b'Guest lineups for the Sunday TV news shows:',84,NA
2016-01-15T11:54:14Z,b'AP PHOTOS: The 2016 Race Heats Up Ahead of Early Voting',b'By THE ASSOCIATED PRESS',"b'With two weeks to go until Iowans head to the polls in the first vote of the 2016 primary season, White House hopefuls went on the offensive this week, with Republican Ted Cruz\'s under new scrutiny for a big loan from Goldman Sachs and Donald Trump labeled by his main rival as embodying ""New York values.""'",107,NA
2016-01-15T11:41:56Z,b'The Smartest Comments of the Republican Debate: Readers Weigh In',b'By ANNA NORTH',,470,"['Carson, Benjamin S', 'Christie, Christopher J']"
2016-01-15T08:35:40Z,b'Lindsey Graham Endorses Jeb Bush for President',b'By ASHLEY PARKER',,593,"['Bush, Jeb', 'Graham, Lindsey']"
2016-01-15T08:30:17Z,b'Trump Strikes Back at Cruz as Bush Lands Key Endorsement',b'By THE ASSOCIATED PRESS',"b'With two weeks to go until Iowans head to the polls in the first vote of the 2016 primary season, Republican front-runner Donald Trump ramped up his attacks against rival Ted Cruz on Friday, while Jeb Bush scored a key endorsement for his White House bid.'",1001,NA
2016-01-15T08:13:56Z,"b""Democratic Presidential Contender O'Malley Investigated Over Furniture Purchases: Post""",b'By REUTERS',"b""Democratic presidential candidate Martin O'Malley, a former Maryland governor, is under investigation for buying furniture from the state executive mansion at sharply discounted prices as he left office, The Washington Post reported on Friday.""",206,NA
2016-01-15T03:52:48Z,"b'Trump, Cruz Assert Their Standing Atop Republican Field'",b'By THE ASSOCIATED PRESS',"b'With just over two weeks until voting begins, Republican presidential candidates Donald Trump and Ted Cruz firmly asserted their standing atop the GOP race in a fiery debate, overshadowing a crowded field of rivals still grappling for a way to overtake the front-runners.'",982,NA
2016-01-15T01:15:35Z,b'Trump Fans in Iowa Cheer His Debate Performance',b'By REUTERS',"b""It was not hard to tell how the Donald Trump fans who jammed the back room at Jethro's BBQ restaurant in Waukee, Iowa, felt about their candidate's debate performance on Thursday night.""",447,NA
2016-01-15T00:02:31Z,b'Trump-Cruz Rivalry Intensifies in Rollicking GOP Debate',b'By THE ASSOCIATED PRESS',"b""The rivalry between the Republican Party's two leading candidates for president intensified in Thursday's debate, which featured the most rollicking action to date.""",985,NA
2016-01-15T00:00:00Z,"b'Your Friday Evening Briefing: Donald Trump, Flint, Coal'",b'By ANDREA KANNAPELL and SANDRA STEVENSON',b'Here\xe2\x80\x99s what you need to know at the end of the day.',862,NA
2016-01-15T00:00:00Z,b'Transcript of Republican Presidential Debate',b'By ANDREA KANNAPELL and SANDRA STEVENSON',"b'The candidates, in their own heated words as recorded by the Federal News Service, sparring on ISIS and Iran, the economy and each other.'",23164,"['Presidential Election of 2016', 'Kasich, John R']"
2016-01-15T00:00:00Z,"b'Trump and Cruz Set an Ugly, Nasty Tone'",b'By FRANK BRUNI',"b'With time running out, the Republicans went for broke at their most venomous meeting yet.'",884,"['Debates (Political)', 'Trump, Donald J']"
2016-01-15T00:00:00Z,"b'At Republican Debate, Taunts and Quips as Rivals Battle'",b'By JONATHAN MARTIN and PATRICK HEALY',b'Donald J. Trump and Senator Ted Cruz of Texas shed months of cordiality as the latest presidential debate became a hand-to-hand fight in their razor-close contest in the Iowa caucuses.',1990,"['Presidential Election of 2016', 'Rubio, Marco']"
2016-01-15T00:00:00Z,b'Uncertain Future for Pizzeria That Gave New Haven a Special Flavor',b'By KRISTIN HUSSEY',"b'A rivalry between Sally\xe2\x80\x99s Apizza and Frank Pepe Pizzeria Napoletana, separated for decades by only a block, is complicated as one considers a sale.'",1243,"['New Haven (Conn)', 'Restaurants']"
2016-01-15T00:00:00Z,b'Transcript: Preliminary Republican Presidential Debate',b'By KRISTIN HUSSEY',"b'A full transcript of the preliminary Republican debate in South Carolina, as transcribed by the Federal News Service.'",8714,"['Debates (Political)', 'Presidential Election of 2016']"
2016-01-15T00:00:00Z,b'What You Missed in the Debate',b'By MATT FLEGENHEIMER',"b'The Republican candidates were in North Charleston, S.C., for the next-to-last debate before voting begins on Feb. 1 in Iowa.'",727,"['Presidential Election of 2016', 'Republican Party']"
2016-01-15T00:00:00Z,"b'New Bernie Sanders Ad, on Wall Street, Fires Back at Hillary Clinton'",b'By NICK CORASANITI',b'The new ad for Senator Bernie Sanders claims that Mrs. Clinton\xe2\x80\x99s plan to regulate Wall Street is disingenuous.',393,"['Sanders, Bernard', 'Presidential Election of 2016']"
2016-01-15T00:00:00Z,b'Republican Debate Spotlight Intensifies as Iowa Caucuses Near',b'By MAGGIE HABERMAN',"b'Face-offs held in the final weeks and days before the presidential nominating contests tend to matter more, and the attacks tend to get rougher.'",866,"['Presidential Election of 2016', 'Debates (Political)']"
2016-01-14T19:40:57Z,"b'Paul Kirk, Ex-D.N.C. Chairman and Ted Kennedy Confidante, Endorses Bernie Sanders'",b'By JASON HOROWITZ',,540,"['Clinton, Hillary Rodham', 'Kennedy, Edward M']"
2016-01-14T19:03:25Z,b'How Pat Buchanan Has Come to Be More Than Another Trump &#8216;Wacko&#8217;',b'By FRANCIS X. CLINES',,389,"['Buchanan, Patrick J', 'Clinton, Hillary Rodham']"
2016-01-14T18:21:57Z,b'Hillary Clinton&#8217;s Campaign Outraged by Bernie Sanders Ad on Wall Street',b'By AMY CHOZICK',,419,"['Benenson, Joel', 'Clinton, Hillary Rodham']"
2016-01-14T18:03:51Z,b'The Latest: Rubio Flips Immigration Issue to Islamic State',b'By THE ASSOCIATED PRESS',"b'Here is the latest from the GOP presidential debates, sponsored by Fox Business Network, in North Charleston, S.C. All times local.'",4110,NA
2016-01-14T17:32:39Z,b'Sanders Endorsed by Former DNC Chairman Kirk',b'By THE ASSOCIATED PRESS',"b'Democratic presidential candidate Bernie Sanders is picking up the endorsement of former Democratic National Committee chairman Paul Kirk, an ally of the late Massachusetts Sen. Ted Kennedy.'",132,NA
2016-01-14T16:49:30Z,b'Clinton Cries Foul Over Sanders TV Ad on Wall Street',b'By THE ASSOCIATED PRESS',"b""Hillary Clinton's presidential campaign on Thursday accused Democratic rival Bernie Sanders of breaking a self-imposed pledge against negative advertising, offering up the latest sign that her campaign is concerned about the Vermont senator's rise in Iowa.""",638,NA
2016-01-14T13:49:54Z,"b""O'Malley Qualifies to Participate in NBC Democratic Debate""",b'By THE ASSOCIATED PRESS',"b""Former Maryland Gov. Martin O'Malley will join the other Democratic candidates in the next presidential debate, scheduled for Sunday in Charleston, South Carolina.""",130,NA
2016-01-14T13:14:31Z,b'Martin O&#8217;Malley Makes the Cut for Next Democratic Debate',b'By MAGGIE HABERMAN',,247,"['Clinton, Hillary Rodham', ""O'Malley, Martin J""]"
2016-01-14T09:25:32Z,b'Twitter Sued by U.S. Widow for Giving Voice to Islamic State',b'By REUTERS',"b'Twitter Inc is being sued by the widow of an American killed in Jordan who accuses the social media company of giving a voice to Islamic State, adding to the pressure to crack down on online propaganda linked to terrorism.'",902,NA
2016-01-14T06:45:33Z,"b'Bernie Sanders Heads to New Hampshire, Following His Momentum There'",b'By ALAN RAPPEPORT',,216,"['Sanders, Bernard', 'Hanover (NH)']"
2016-01-14T06:30:26Z,b'Bill Clinton Shares Memories of Hillary Clinton&#8217;s Ability to Connect With His Adversaries',b'By NICK CORASANITI',,262,"['Clinton, Bill', 'Clinton, Hillary Rodham']"
2016-01-14T05:45:37Z,b'Food and the Single Girl',b'By JEN A. MILLER',,952,"['Diet and Nutrition', 'Exercise']"
2016-01-14T03:40:00Z,"b""Campaign Ads Deluge 'Wheel' Watchers, Morning Shows""",b'By THE ASSOCIATED PRESS',"b'Political groups are flooding the airwaves with advertisements during popular game shows, including ""Wheel of Fortune,"" \'\'Jeopardy!"" and ""Family Feud,"" and pouring money into spots during local news and network morning shows as they try to sway presidential primary voters, according to an analysis by The Associated Press.'",911,NA
2016-01-14T03:37:39Z,"b""AP Conversation: Bush Sees Conservatism at Stake in '16""",b'By THE ASSOCIATED PRESS',"b'Jeb Bush says he misjudged the intensity of anger among Republican voters before his White House campaign and believes the country in 2016 is ""dramatically different"" than in past elections.'",697,NA
2016-01-14T03:36:42Z,"b""AP Conversation: Bush Sees Conservatism at Stake in '16""",b'By THE ASSOCIATED PRESS',"b'Jeb Bush says he misjudged the intensity of anger among Republican voters before his White House campaign and believes the country in 2016 is ""dramatically different"" than in past elections. Yet he insists he\'s still a viable candidate, and one who has broadened his mission to include defending conservativism from GOP front-runner Donald Trump.'",1160,NA
2016-01-14T03:34:59Z,"b""Q&A: The Obama Administration's Recent Immigration Raids""",b'By THE ASSOCIATED PRESS',b'The Obama administration arrested more than 120 immigrants during two days of raids targeting Central American families who came to the country illegally since 2014. The arrests of immigrants who had been ordered out of the country prompted protests from immigration advocates and lawmakers who have said the enforcement harms families and is a dangerous precedent.',587,NA
2016-01-14T03:31:29Z,"b'Challenged Anew, Clinton Reaching Back Into 2008 Playbook'",b'By THE ASSOCIATED PRESS',"b""Hillary Clinton's 2016 campaign is beginning to sound like her 2008 one.""",119,NA
2016-01-14T03:22:30Z,"b""Trump, Cruz Go at Each Other in Year's First GOP Debate""",b'By THE ASSOCIATED PRESS',"b'Republican presidential candidates Donald Trump and Ted Cruz clashed Thursday night over the Texas senator\'s eligibility to serve as commander in chief and the businessman\'s ""New York values,"" ending months of civility between fiery contenders seeking to tap into voter anger and frustration.'",1017,NA
2016-01-14T00:00:00Z,b'Why I Will Never Vote for Donald Trump',b'By PETER WEHNER',b'Party loyalty has limits. Mr. Trump has altered the political equation because he has altered the moral equation.',1165,"['Presidential Election of 2016', 'Trump, Donald J']"
2016-01-14T00:00:00Z,b'The Tempting of Bernie Sanders',b'By ROSS DOUTHAT',b'Is he ruthless enough to win?',1111,"['Presidential Election of 2016', 'Sanders, Bernard']"
2016-01-14T00:00:00Z,"b'Hillary Clinton Ad Seconds Obama on Guns, Rebuking Bernie Sanders'",b'By NICK CORASANITI',"b'In the new 30-second clip, Mrs. Clinton cites her support for the president\xe2\x80\x99s gun-control measures, a indirect reminder of what she has called Mr. Sanders\xe2\x80\x99s reluctance to stand up to the gun industry.'",484,"['Gun Control', 'Presidential Election of 2016']"
2016-01-14T00:00:00Z,b'Donald Trump\xe2\x80\x99s Iowa Ground Game Seems to Be Missing a Coach',b'By TRIP GABRIEL',"b'Mr. Trump may well win the caucuses, but if he does, it will probably be in spite of his organizing team, which is still committing basic organizing errors.'",1306,"['Presidential Election of 2016', 'Trump, Donald J']"
2016-01-13T19:09:38Z,b'Bill Clinton Cites Personal Losses in Pushing Fight Against Drug Abuse',b'By NICK CORASANITI',,325,NA
2016-01-13T17:49:54Z,"b'Hillary Clinton and Bernie Sanders Intensify Fight over Health, Guns and Costs'",b'By MAGGIE HABERMAN and ALAN RAPPEPORT',,948,"['Clinton, Bill', 'Clinton, Chelsea']"
2016-01-13T17:08:50Z,b'Sanders Congressional Record Under Scrutiny by Clinton',b'By THE ASSOCIATED PRESS',"b'Bernie Sanders casts himself as the voice of anti-establishment politics, fueling his insurgent rise in the Democratic primaries as a principled fighter unwilling to compromise for political gain.'",932,NA
2016-01-13T14:09:02Z,"b""AP Conversation: Bush Sees Conservatism at Stake in '16""",b'By THE ASSOCIATED PRESS',"b'Jeb Bush says he misjudged the intensity of anger among Republican voters before his White House campaign and believes the country in 2016 is ""dramatically different"" than in past elections. Yet he insists he\'s still a viable candidate, and one who has broadened his mission to include defending conservativism from GOP front-runner Donald Trump.'",1153,NA
2016-01-13T13:34:35Z,"b""Obama's State of the Union Gets Most Young Love in the West""",b'By REUTERS',"b""Millennnials in the West of the United States showed the strongest support for President Barack Obama's final State of the Union address, according to data provided by Yik Yak, a location-based mobile app that is popular with young people.""",460,NA
2016-01-13T12:12:56Z,"b""Christie Warns Voters: Don't Elect a First-Term Senator""",b'By THE ASSOCIATED PRESS',"b'Chris Christie is pressing people in New Hampshire to avoid voting for a first-time senator in the coming presidential primary, and holding out Barack Obama as an example of what can happen when they do.'",398,NA
2016-01-13T12:01:42Z,b'What Would You Ask Hillary Clinton?',b'By THE EDITORS',,91,"['Clinton, Hillary Rodham', 'Democratic Party']"
2016-01-13T10:40:08Z,"b'Verbatim: What Hillary Clinton, Powerball Winner, Would Do'",b'By FIRST DRAFT',,36,"['Clinton, Hillary Rodham', 'Campaign Finance']"
2016-01-13T07:00:28Z,"b'As Bernie Sanders Gains Momentum, Hillary Clinton Shows Signs of Noticing'",b'By MAGGIE HABERMAN',,346,NA
2016-01-13T06:15:39Z,b'2 Democrats Seek to Take Gunmakers&#8217; Liability Shield',b'By JENNIFER STEINHAUER',,303,"['Schiff, Adam B', 'Democratic Party']"
2016-01-13T03:57:16Z,b'Clinton Gets Nod From Former Attorney General Eric Holder',b'By THE ASSOCIATED PRESS',"b""As she works to maintain an advantage among African-American voters in her quest for the Democratic presidential nomination, Hillary Clinton has secured an endorsement from the nation's first black attorney general.""",563,NA
2016-01-13T03:51:25Z,b'Sanders Ad Burst Coincides With Upward Movement in Polls',b'By THE ASSOCIATED PRESS',b'Bernie Sanders has been putting up major advertising cash to seize momentum heading into the Democratic presidential primaries &#8212; outspending his rival Hillary Clinton just as voters are beginning to pay attention to the race.',920,NA
2016-01-13T03:34:52Z,b'Obama Summons Americans to Compromise and Change',b'By THE ASSOCIATED PRESS',"b'With Americans soon to begin choosing his successor, President Barack Obama is casting his seven divisive years as a time of positive change, implicitly asking voters to replace him with a Democrat who would continue his hard-won policies on health care, climate change and Iran.'",914,NA
2016-01-13T03:28:39Z,b'Analysis: Obama in Campaign Form in Final State of the Union',b'By THE ASSOCIATED PRESS',"b""President Barack Obama opened his State of the Union speech saying he'd keep it short, in what must have seemed music to the ears of some in the chamber antsy to get to Iowa to campaign for president.""",812,NA
2016-01-13T01:33:18Z,b'Trump Looms Behind Both Obama and Haley Speeches',b'By REUTERS',"b'Donald Trump was not in the room during U.S. President Barack Obama&#8217;s final State of the Union speech, but the Republican presidential front-runner was a looming presence nonetheless. '",854,NA
2016-01-13T00:54:15Z,"b'Obama Knocks Trump, Voices Optimism'",b'By REUTERS',b'By Jeff Mason and Roberta Rampton',963,NA
